{
  "schemaVersion": "1",
  "buildId": "generic-optimal",
  "missionId": "cold-start",
  "name": "Generic Optimal",
  "version": 1,
  "sharedDoctrine": "Complete the mission optimally and efficiently. Communicate when useful.",
  "agents": {
    "wren": {
      "roleOrder": "Choose the best legal action to complete your assigned goals. Avoid unnecessary risk.",
      "briefingCardIds": [
        "power-contract",
        "extraction-contract",
        "comms-intel",
        "repair-protocol"
      ],
      "moduleId": "rapid-repair-kit"
    },
    "kite": {
      "roleOrder": "Choose the best legal action to complete your assigned goals. Avoid unnecessary risk.",
      "briefingCardIds": [
        "sync-contract",
        "recovery-contract",
        "kite-sensor-intel",
        "route-intel"
      ],
      "moduleId": "signal-repeater"
    }
  },
  "hypothesis": null
}
